{
  "gate": "check_single_writer",
  "protocol_version": "1",
  "scanner_version": "a5a3b4572e20fc69dc7ae3f243ea203d3eca8f07420496cb7f7ada763e8b8633",
  "telemetry_dependent": false,
  "concurrency_applicable": false,
  "concurrency_note": "check_single_writer is a single-pass static scan of checked-in source at a fixed SHA — there is no concurrent/racing writer dimension in the artifact itself to evade (the invariant it checks, an atomic single write PATH in code, is a design-time property, not a runtime race).",
  "authority_boundary": {
    "proves": "every writer of a single-write-path invariant's controls_field, found by scanning a Go/Mongo/SQL source tree for assignments, struct-literal sets, bson $set mutations, and SQL UPDATE ... SET, is reported as a violation unless its enclosing symbol or file is in sanctioned_writers",
    "artifact": "a git worktree copy of the target repo's tracked source tree (vendor/node_modules/dist/build/.git excluded by design)",
    "assumptions": [
      "the invariant carries well-formed controls_field + sanctioned_writers metadata (structured state-machines.json or prose @cw-writes tag)",
      "a writer that never appears as a literal quoted/assigned field-name token (fully dynamic field construction through reflection or string concatenation) is not detectable by a regex scanner",
      "vendor/node_modules/dist/build subtrees are explicitly out of scope (SKIP_PARTS) — a writer placed there will not be found",
      "test-file writes are treated as fixtures, never violations, per the is_test heuristic"
    ]
  },
  "seeded_defect_trials": [
    {
      "seed_id": "sw-direct-01",
      "seed_class": "direct",
      "seed_version": "1",
      "repo": "tests/fixtures/gate_validation/single_writer_clean",
      "sha": "a67c9da829598aa2d99a97aaa16fec55d5800f7a",
      "injected": "internal/admin/handlers.go: ChangePlan writes provider.plan via bson $set, outside INV-bil-001's sanctioned_writers",
      "expected": "fire",
      "result": "fired",
      "passed": true
    },
    {
      "seed_id": "sw-omission-01",
      "seed_class": "evasion-omission",
      "seed_version": "1",
      "repo": "tests/fixtures/gate_validation/single_writer_clean",
      "sha": "a67c9da829598aa2d99a97aaa16fec55d5800f7a",
      "injected": "internal/db/leak.go: an unsanctioned write of provider.active_owner_count hidden inside a nested anonymous closure with no directly-enclosing named function at the write site",
      "expected": "fire",
      "result": "fired",
      "passed": true
    },
    {
      "seed_id": "sw-config-indirection-01",
      "seed_class": "evasion-config-indirection",
      "seed_version": "1",
      "repo": "tests/fixtures/gate_validation/single_writer_clean",
      "sha": "a67c9da829598aa2d99a97aaa16fec55d5800f7a",
      "injected": "internal/wrappers/generic.go: a generically-named SetField helper writes provider.stripe_plan via bson $set — indirection through a wrapper function, not the sanctioned symbol name",
      "expected": "fire",
      "result": "fired",
      "passed": true
    },
    {
      "seed_id": "sw-sampling-gap-01",
      "seed_class": "evasion-sampling-gap",
      "seed_version": "1",
      "repo": "tests/fixtures/gate_validation/single_writer_clean",
      "sha": "a67c9da829598aa2d99a97aaa16fec55d5800f7a",
      "injected": "vendor/thirdparty/patch.go: an unsanctioned write of provider.stripe_plan placed inside the vendor/ subtree, which SKIP_PARTS excludes by design",
      "expected": "no-fire",
      "result": "not-fired",
      "passed": true
    }
  ],
  "clean_corpus_runs": [
    {
      "repo": "tests/fixtures/gate_validation/single_writer_clean",
      "sha": "a67c9da829598aa2d99a97aaa16fec55d5800f7a",
      "findings": 0,
      "coverage": {"invariants_checked": 3, "writers_found": 3},
      "passed": true
    }
  ],
  "status": "passed",
  "validated_at": "2026-07-19T00:00:00Z",
  "validated_by": "chief-wiggum#168",
  "ratchet_record_id": "N/A — chief-wiggum has no docs/quality/ratchet.json of its own; see tests/test_gate_validation_retroactive.py for the live trials that back this record"
}
