{
  "gate": "saas_gate",
  "protocol_version": "1",
  "scanner_version": "46e327ddffa902a70290b577b882d1d159c22e08764009fdf88d6f3679c490f0",
  "telemetry_dependent": false,
  "concurrency_applicable": false,
  "concurrency_note": "saas_gate issues sequential, single deterministic HTTP exchanges (GET /, /health, /login) against a scripted fixture server; each probe's response is fixed for the scenario. There is no concurrent/racing dimension in the fixture target to evade \u2014 the rate-limit probe counts sequential attempts, not concurrent ones.",
  "authority_boundary": {
    "proves": "over a running HTTP endpoint, every FAIL-class SaaS NFR finding the gate makes fires on an injected instance (missing security header, a CSRF cookie whose SameSite is not Lax/Strict even when disguised with stray whitespace), while a documented non-FAIL boundary (a never-429 /login without --rate-limit-required, a header served via case-insensitive name indirection) correctly does NOT fire \u2014 driven end-to-end through the real CLI (real urllib.request, real HTTP, real header parsing)",
    "artifact": "the REAL scripts/saas_gate.py CLI run as a subprocess against a scripted, deterministic local http.server on 127.0.0.1 (tests/fixtures/gate_validation/saas_gate_clean/saas_gate_server.py), with a trivial fixture repo (pyproject.toml -> detect_stack ['python']) as --repo",
    "assumptions": [
      "VALIDATED AGAINST A SCRIPTED LOCAL HTTP FIXTURE SERVER, NOT A LIVE PRODUCTION/STAGING URL (CTR-fh-044): a real deployment's TLS configuration, load-balancer/proxy-injected headers, CDN or WAF behaviour, and rate-limiter timing may surface additional findings \u2014 or mask them \u2014 that this record says nothing about",
      "the base URL is HTTP, so HSTS is a WARN (not a FAIL) and cookie Secure is not required; an HTTPS target changes those to FAIL-eligible and is out of this record's scope",
      "tenant-isolation, performance/response-time, structured-logging (no --log-sample), and audit-trail checks are SKIPPED by run_gate without a live multi-user app / log sample and are therefore not exercised here \u2014 a SKIPPED status is honestly reported, never counted as a pass",
      "the gate's verdict (report.ok) is FALSE iff any finding has status FAIL; WARN/SKIPPED/NA never block, by design"
    ]
  },
  "seeded_defect_trials": [
    {
      "seed_id": "saas-instrument-broken-01",
      "seed_class": "instrument-broken",
      "seed_version": "1",
      "repo": "tests/fixtures/gate_validation/saas_gate_clean",
      "sha": "sha256:a009eb20e6c457f712be139a246ae0bcfaf6f0d01e249e12bf0675b9a3985235",
      "injected": "an explicitly-supplied --base-url that cannot be reached. The target's actual security posture is unknown, not good; before #289 the six-check header/CSRF battery collapsed into one SKIPPED, and SKIPPED can never fail --gate.",
      "expected": "fire",
      "result": "fired",
      "passed": true
    },
    {
      "seed_id": "saas-direct-01",
      "seed_class": "direct",
      "seed_version": "1",
      "repo": "tests/fixtures/gate_validation/saas_gate_clean",
      "sha": "sha256:a009eb20e6c457f712be139a246ae0bcfaf6f0d01e249e12bf0675b9a3985235",
      "injected": "scenario 'missing_headers': the root response omits Content-Security-Policy and X-Content-Type-Options entirely -> two FAIL findings (content-security-policy 'missing', x-content-type-options 'missing (want nosniff)')",
      "expected": "fire",
      "result": "fired",
      "passed": true
    },
    {
      "seed_id": "saas-omission-01",
      "seed_class": "evasion-omission",
      "seed_version": "1",
      "repo": "tests/fixtures/gate_validation/saas_gate_clean",
      "sha": "sha256:a009eb20e6c457f712be139a246ae0bcfaf6f0d01e249e12bf0675b9a3985235",
      "injected": "scenario 'csrf_samesite_none_spaced': the session cookie carries 'SameSite = None' with stray whitespace a naive substring check might miss; the structural _cookie_attrs parser still normalizes it to samesite=none and FAILs the csrf check ('SameSite=none (need Lax/Strict)')",
      "expected": "fire",
      "result": "fired",
      "passed": true
    },
    {
      "seed_id": "saas-config-indirection-01",
      "seed_class": "evasion-config-indirection",
      "seed_version": "1",
      "repo": "tests/fixtures/gate_validation/saas_gate_clean",
      "sha": "sha256:a009eb20e6c457f712be139a246ae0bcfaf6f0d01e249e12bf0675b9a3985235",
      "injected": "scenario 'headers_lowercased': an otherwise-healthy response serves every security header NAME lower-cased (content-security-policy, x-content-type-options, ...). The gate's case-insensitive _hget must still recognize them as present+healthy -> zero FAIL findings. A certified non-coverage-evasion boundary: casing indirection neither dodges detection nor causes a spurious finding, so the gate correctly does not fire.",
      "expected": "no-fire",
      "result": "not-fired",
      "passed": true
    },
    {
      "seed_id": "saas-sampling-gap-01",
      "seed_class": "evasion-sampling-gap",
      "seed_version": "1",
      "repo": "tests/fixtures/gate_validation/saas_gate_clean",
      "sha": "sha256:a009eb20e6c457f712be139a246ae0bcfaf6f0d01e249e12bf0675b9a3985235",
      "injected": "scenario 'no_rate_limit': /login returns 200 on every one of the 20 probe attempts, never 429. Absent --rate-limit-required, check_rate_limit marks this WARN (not FAIL) by design -> report.ok stays True. A never-429 endpoint is a certified non-finding under the default scope, not a scanner miss, so the gate correctly does not fire.",
      "expected": "no-fire",
      "result": "not-fired",
      "passed": true
    }
  ],
  "clean_corpus_runs": [
    {
      "repo": "tests/fixtures/gate_validation/saas_gate_clean",
      "sha": "sha256:a009eb20e6c457f712be139a246ae0bcfaf6f0d01e249e12bf0675b9a3985235",
      "findings": 0,
      "coverage": {
        "security_checks": 7,
        "runtime_probes": 2,
        "checks_passed": 7
      },
      "passed": true
    }
  ],
  "status": "passed",
  "validated_at": "2026-08-04T00:00:00Z",
  "validated_by": "chief-wiggum#184; re-authored for chief-wiggum#295: chief_wiggum/hashing.py gained ID_BEARING_ARTIFACTS/find_id_bearing_artifacts/scan_malformed_ids (reusing trace_ids.near_miss_ids from #281 rather than a second detector). hashing.py is a finding-affecting scanner_version hash input for every shipped gate, so this gate's version moved even though its OWN behaviour is unchanged \u2014 trials and clean-corpus runs are unchanged and were re-verified live.; re-authored for chief-wiggum#289: a network failure on an explicitly-supplied --base-url collapsed the entire six-check header/CSRF battery into a single SKIPPED finding \u2014 and SKIPPED can never fail --gate, so an unreachable target passed the security battery by not being probed at all. A new ERROR status, distinct from the honest SKIPPED of an absent probe, is now emitted per check when the probe cannot run, and report.ok/--gate fail on ERROR exactly as on FAIL. --repo is validated (exit 2 for a nonexistent path) instead of silently degrading to an empty stack. to_dict carries a measured denominator (total/measured/skipped/error). The honest-absence path \u2014 no --base-url given at all \u2014 still reports SKIPPED and does NOT block; trials unchanged and re-verified live.",
  "ratchet_record_id": "rec-00075"
}
